{
  "name": "Counter 1",
  "merchant_name": "Seguras Butcher",
  "description": "Retail butcher counter",
  "branding": {
    "logo_url": null,
    "theme": "default",
    "primary_color": null
  },
  "currency": "CRC",
  "methods": [
    { "type": "liquid", "asset": "L-BTC" },
    {
      "type": "lightning_via_swap",
      "settlement": "liquid",
      "providers": ["boltz"],
      "claim_mode": "standard"
    },
    {
      "type": "bolt_card",
      "settlement": "liquid",
      "providers": ["boltz"],
      "claim_mode": "standard"
    }
  ],
  "relays": [
    "wss://no.str.cr",
    "wss://relay.primal.net",
    "wss://nos.lol"
  ],
  "liquid_backends": [
    { "type": "esplora", "url": "https://liquid.bullbitcoin.com/api" }
  ],
  "swap_providers": [
    {
      "id": "boltz-mainnet",
      "type": "boltz",
      "api_base": "https://api.boltz.exchange",
      "ws_url": "wss://api.boltz.exchange/v2/ws"
    }
  ],
  "fiat_provider": {
    "type": "bull_bitcoin",
    "url": "https://www.bullbitcoin.com/api/price",
    "mode": "anonymous"
  },
  "public_receipts": false
}
